{
  "resourceType" : "VerificationResult",
  "id" : "example",
  "text" : {
    "status" : "generated",
    "div" : "<div xmlns=\"http://www.w3.org/1999/xhtml\"><p><b>Generated Narrative: VerificationResult</b><a name=\"example\"> </a></p><div style=\"display: inline-block; background-color: #d9e0e7; padding: 6px; margin: 4px; border: 1px solid #8da1b4; border-radius: 5px; line-height: 60%\"><p style=\"margin-bottom: 0px\">Resource VerificationResult &quot;example&quot; </p></div><p><b>status</b>: <span title=\" \n\t&lt;target&gt;\n\t\t&lt;display value=&quot;Dr Feelbetter&quot; /&gt;\n\t&lt;/target&gt;\n\t&lt;need value=&quot;initial&quot; /&gt;  \">attested</span></p></div>"
  },
  "status" : "attested"
}
